{
  "$schema": "http://json-schema.org/draft-06/schema",
  "type": "object",
  "properties": {
    "version": {
      "type": "number"
    },
    "success": {
      "type": "boolean"
    },
    "reason": {},
    "content": {
      "type": "object",
      "properties": {
        "value": {
          "type": "array",
          "items": {
            "type": "object",
            "properties": {
              "id": {
                "type": "string"
              },
              "reportId": {
                "type": "string"
              },
              "type": {
                "type": [
                  "null",
                  "string"
                ]
              },
              "startTime": {
                "type": "string"
              },
              "endTime": {
                "type": "string"
              },
              "lastModifiedTime": {
                "type": "string"
              },
              "status": {
                "type": "string"
              },
              "configurationVersion": {
                "type": "string"
              },
              "rebootRequested": {},
              "refreshMode": {},
              "reportFormatVersion": {
                "type": "string"
              }
            }
          }
        }
      }
    },
    "raw": {},
    "inputs": {
      "type": "object",
      "properties": {
        "account_name": {
          "type": "string"
        },
        "resource_group_name": {
          "type": "string"
        },
        "node_id": {
          "type": "string"
        }
      }
    },
    "metrics": {
      "type": "object",
      "properties": {
        "version": {
          "type": "string"
        },
        "package": {
          "type": "string"
        },
        "package_version": {
          "type": "string"
        },
        "host": {
          "type": "string"
        },
        "execution_time_ms": {
          "type": "integer"
        },
        "timestamp": {
          "type": "string"
        }
      }
    }
  }
}